{
  "schema_version": "1.1",
  "alert_id": "3d9a71f0-4c18-4b27-b9e5-6a0f2c841d55",
  "dedupe_key": "b7b4db4f767f6a79059dfe21cc7eb7622d959744",
  "pillar": "pr_security",
  "producer": {
    "name": "gatehouse",
    "version": "0.1.0"
  },
  "finding_type": "pr_security.hardcoded_secret",
  "title": "Possible credential committed in a pull request",
  "severity": "critical",
  "severity_id": 5,
  "status": "acknowledged",
  "observed_at": "2026-07-25T09:20:00Z",
  "first_seen_at": "2026-07-25T09:20:00Z",
  "last_seen_at": "2026-07-25T09:20:00Z",
  "resource": {
    "kind": "pull_request",
    "ref": "github:hawikk/ai-monitoring#412",
    "display": "hawikk/ai-monitoring#412",
    "provider": "github",
    "account_ref": "hawikk",
    "region": null
  },
  "evidence": {
    "source_uri": "gatehouse:/checks/9912/annotations",
    "detail_count": 1,
    "summary": "High-entropy string matching an AWS secret-key shape in a changed file."
  }
}
